{"description":"能够建立 Go module，使用 build、test、vet 获取反馈，并区分代码失败与工具基础设施失败。","domain":"tooling","id":"M1-01","milestone":"M1","name":"运行模型、工具链与 module","prerequisites":{"hard":[],"recommended":[]},"required_evidence":[{"context":"same_context","independence":"independent","rule_ids":["module-builds"],"type":"implement"},{"context":"same_context","independence":"independent","rule_ids":["toolchain-checks-pass"],"type":"diagnose"}],"resource_refs":["web/src/content/go-basics/ch01-getting-started.mdx","web/src/content/go-basics/ch10-packages-tools.mdx"],"review_policy":{"failure_remediation_after_days":1,"first_review_after_days":3,"success_interval_days":14},"version":2}