{
  "id":"M2-09","version":1,"name":"配置、依赖初始化与 graceful shutdown","description":"能够在 composition root 先校验配置、显式初始化依赖，在失败时逆序回滚，并在取消或信号下有界逆序关闭资源。","milestone":"M2","domain":"configuration-initialization-graceful-shutdown",
  "prerequisites":{"hard":[{"id":"M2-03","version":1},{"id":"M2-04","version":1},{"id":"M1-13","version":1}],"recommended":[]},
  "required_evidence":[
    {"type":"implement","independence":"independent","context":"same_context","rule_ids":["lifecycle-builds","config-before-init","dependencies-initialized-explicitly","startup-failure-rolls-back","cancellation-shutdown-ordered","serve-failure-cleans-up","lifecycle-calls-present"]},
    {"type":"test","independence":"independent","context":"same_context","rule_ids":["lifecycle-tests-present"]},
    {"type":"diagnose","independence":"independent","context":"same_context","rule_ids":["lifecycle-boundaries-explained"]}
  ],
  "review_policy":{"first_review_after_days":7,"success_interval_days":30,"failure_remediation_after_days":1},
  "resource_refs":["web/src/content/learning/lifecycle-stack-practice-v1.mdx","https://pkg.go.dev/os/signal#NotifyContext","https://pkg.go.dev/net/http#Server.Shutdown","https://go.dev/doc/database/manage-connections"]
}
