{"description":"能够设计稳定的 JSON 请求响应 DTO，严格校验输入，并把参数、冲突和内部错误映射为一致且不泄漏实现细节的 HTTP 错误协议。","domain":"api-contract-validation","id":"M2-02","milestone":"M2","name":"API 契约、JSON 校验与错误映射","prerequisites":{"hard":[{"id":"M2-01","version":1},{"id":"M1-03","version":1}],"recommended":[]},"required_evidence":[{"context":"same_context","independence":"independent","rule_ids":["api-contract-builds","json-contract-correct","validation-errors-stable"],"type":"implement"},{"context":"same_context","independence":"independent","rule_ids":["api-boundary-tests-present"],"type":"test"},{"context":"same_context","independence":"independent","rule_ids":["api-error-mapping-explained"],"type":"diagnose"}],"resource_refs":["web/src/content/learning/json-api-contract-practice-v1.mdx","https://pkg.go.dev/encoding/json","https://pkg.go.dev/net/http","https://go.dev/blog/go1.13-errors"],"review_policy":{"failure_remediation_after_days":1,"first_review_after_days":7,"success_interval_days":30},"version":1}