{"description":"能够设计可判断的错误契约，增加操作上下文，保留必要的 error chain，并用 defer 可靠释放资源。","domain":"program-structure","id":"M1-03","milestone":"M1","name":"函数、错误契约与资源清理","prerequisites":{"hard":[{"id":"M1-01","version":1}],"recommended":[]},"required_evidence":[{"context":"same_context","independence":"independent","rule_ids":["error-chain-preserved","resource-closed"],"type":"implement"}],"resource_refs":["web/src/content/go-basics/ch05-functions.mdx","web/src/content/go-basics/ch07-interfaces.mdx"],"review_policy":{"failure_remediation_after_days":1,"first_review_after_days":3,"success_interval_days":14},"version":1}