{"description":"能够补全一个包含 package、函数、变量和分支的最小 Go 程序，运行它并用 Build、Test、Vet 判断代码是否满足预期。","domain":"tooling","id":"M1-01","milestone":"M1","name":"编写并运行第一个 Go 程序","prerequisites":{"hard":[],"recommended":[]},"required_evidence":[{"context":"same_context","independence":"independent","rule_ids":["first-program-builds","first-program-behavior-passes"],"type":"implement"},{"context":"same_context","independence":"independent","rule_ids":["feedback-loop-explained"],"type":"diagnose"}],"resource_refs":["web/src/content/go-basics/ch01-getting-started.mdx","web/src/content/go-basics/ch02-program-structure.mdx"],"review_policy":{"failure_remediation_after_days":1,"first_review_after_days":3,"success_interval_days":14},"version":3}