{"description":"能够从失败测试、业务栈帧、断点记录、静态检查和基础 profile 中定位缺陷，并形成证据到修改的可复核链路。","domain":"debugging-diagnostics","id":"M1-10","milestone":"M1","name":"调试、静态检查与性能证据","prerequisites":{"hard":[{"id":"M1-01","version":2},{"id":"M1-09","version":1}],"recommended":[{"id":"M1-03","version":1}]},"required_evidence":[{"context":"same_context","independence":"independent","rule_ids":["regression-fixed"],"type":"implement"},{"context":"same_context","independence":"independent","rule_ids":["static-analysis-clean","profile-diagnosis-explained"],"type":"diagnose"}],"resource_refs":["web/src/content/go-basics/ch10-packages-tools.mdx","web/src/content/go-basics/ch11-testing.mdx","https://go.dev/doc/diagnostics","https://go.dev/blog/pprof"],"review_policy":{"failure_remediation_after_days":1,"first_review_after_days":3,"success_interval_days":14},"version":1}