{"description":"能够把程序拆成依赖方向清晰的包，控制导出 API，并为面向使用者的声明编写有效文档。","domain":"package-api-design","id":"M1-08","milestone":"M1","name":"包、模块、API 与文档设计","prerequisites":{"hard":[{"id":"M1-05","version":1},{"id":"M1-06","version":1},{"id":"M1-07","version":1}],"recommended":[]},"required_evidence":[{"context":"same_context","independence":"independent","rule_ids":["package-graph-builds","exported-api-usable","exported-api-documented"],"type":"implement"}],"resource_refs":["web/src/content/go-basics/ch02-program-structure.mdx","web/src/content/go-basics/ch10-packages-tools.mdx","https://go.dev/doc/modules/developing","https://go.dev/doc/comment"],"review_policy":{"failure_remediation_after_days":1,"first_review_after_days":3,"success_interval_days":14},"supersedes":{"id":"M1-08","version":1},"version":2}