{"description":"能够用表格驱动测试、子测试和临时目录覆盖成功与失败路径，并让测试失败信息支持快速诊断。","domain":"testing","id":"M1-09","milestone":"M1","name":"自动化测试与测试设计","prerequisites":{"hard":[{"id":"M1-01","version":1}],"recommended":[{"id":"M1-03","version":1}]},"required_evidence":[{"context":"same_context","independence":"independent","rule_ids":["learner-tests-present","visible-tests-pass","held-out-tests-pass"],"type":"test"}],"resource_refs":["web/src/content/go-basics/ch11-testing.mdx"],"review_policy":{"failure_remediation_after_days":1,"first_review_after_days":3,"success_interval_days":14},"version":1}