{"description":"能够用 request ID 关联一次请求的 structured log，以低基数 route template、method 和 status class 聚合指标，并严格区分进程 liveness 与依赖 readiness。","domain":"observability-health-correlation","id":"M2-12","milestone":"M2","name":"日志、指标、健康检查与请求关联","prerequisites":{"hard":[{"id":"M2-02","version":1},{"id":"M2-09","version":1}],"recommended":[]},"required_evidence":[{"context":"same_context","independence":"independent","rule_ids":["observability-builds","request-correlation","request-id-validation","bounded-metric-labels","response-observation","liveness-contract","readiness-contract","observability-constructor","observability-calls-present"],"type":"implement"},{"context":"same_context","independence":"independent","rule_ids":["observability-tests-present"],"type":"test"},{"context":"same_context","independence":"independent","rule_ids":["observability-boundaries-explained"],"type":"diagnose"}],"resource_refs":["web/src/content/learning/request-telemetry-practice-v1.mdx","https://pkg.go.dev/log/slog","https://pkg.go.dev/net/http","https://sre.google/sre-book/monitoring-distributed-systems/"],"review_policy":{"failure_remediation_after_days":1,"first_review_after_days":7,"success_interval_days":30},"version":1}