{"description":"能够从使用方需求定义最小接口，用替身验证依赖边界，并用简单泛型提取真正跨类型复用的算法。","domain":"abstraction-design","id":"M1-06","milestone":"M1","name":"接口边界、测试替身与实用泛型","prerequisites":{"hard":[{"id":"M1-05","version":1}],"recommended":[{"id":"M1-09","version":1}]},"required_evidence":[{"context":"same_context","independence":"independent","rule_ids":["consumer-interface-minimal","generic-helper-declared","substitute-contract-correct","generic-helper-reusable"],"type":"implement"}],"resource_refs":["web/src/content/go-basics/ch07-interfaces.mdx","https://go.dev/doc/tutorial/generics","https://go.dev/blog/intro-generics","https://go.dev/wiki/CodeReviewComments"],"review_policy":{"failure_remediation_after_days":1,"first_review_after_days":3,"success_interval_days":14},"version":1}