{"description":"能够用 net/http 组装 method-aware 路由、handler 与请求上下文 middleware，配置 server timeout，并在取消后等待活动请求完成优雅关闭。","domain":"http-server-lifecycle","id":"M2-01","milestone":"M2","name":"标准库 HTTP 服务边界","prerequisites":{"hard":[{"id":"M1-14","version":1}],"recommended":[]},"required_evidence":[{"context":"same_context","independence":"independent","rule_ids":["http-service-builds","route-contract-correct","request-context-propagates","server-timeouts-configured","graceful-shutdown-correct"],"type":"implement"},{"context":"same_context","independence":"independent","rule_ids":["handler-tests-present"],"type":"test"},{"context":"same_context","independence":"independent","rule_ids":["http-lifecycle-explained"],"type":"diagnose"}],"resource_refs":["web/src/content/learning/http-request-slice-v1.mdx","https://pkg.go.dev/net/http","https://pkg.go.dev/net/http/httptest","https://pkg.go.dev/context","https://go.dev/doc/articles/wiki/"],"review_policy":{"failure_remediation_after_days":1,"first_review_after_days":7,"success_interval_days":30},"version":1}