{"description":"能够从文件读取和校验 JSON，稳定编码输出，并通过 stdout、stderr 和退出码形成可自动化的 CLI 契约。","domain":"io-cli","id":"M1-07","milestone":"M1","name":"文件、流、JSON 与 CLI 契约","prerequisites":{"hard":[{"id":"M1-01","version":1},{"id":"M1-03","version":1}],"recommended":[]},"required_evidence":[{"context":"same_context","independence":"independent","rule_ids":["invalid-input-rejected","stable-output","cli-failure-contract"],"type":"implement"}],"resource_refs":["web/src/content/go-basics/ch04-composite-types.mdx","web/src/content/go-basics/ch10-packages-tools.mdx"],"review_policy":{"failure_remediation_after_days":1,"first_review_after_days":3,"success_interval_days":14},"version":1}