{
  "id": "M2-15",
  "version": 1,
  "name": "Miniflux 导览与真实修改",
  "description": "能够在固定版本的 Miniflux 中沿 API 或后台刷新链定位真实修改点，提交符合上游结构、可测试、可解释且可回滚的训练 patch。",
  "milestone": "M2",
  "domain": "open-source-codebase-navigation",
  "prerequisites": {
    "hard": [
      {"id": "M2-07", "version": 1},
      {"id": "M2-10", "version": 1},
      {"id": "M2-12", "version": 1},
      {"id": "M2-13", "version": 1},
      {"id": "M2-14", "version": 1}
    ],
    "recommended": []
  },
  "required_evidence": [
    {
      "type": "test",
      "independence": "independent",
      "context": "same_context",
      "rule_ids": [
        "miniflux-slice-builds",
        "category-normalization-contract",
        "category-update-contract",
        "category-test-cases",
        "category-normalizer-used"
      ]
    },
    {
      "type": "diagnose",
      "independence": "independent",
      "context": "same_context",
      "rule_ids": ["miniflux-patch-explained"]
    }
  ],
  "review_policy": {
    "first_review_after_days": 7,
    "success_interval_days": 30,
    "failure_remediation_after_days": 1
  },
  "resource_refs": [
    "web/src/content/learning/miniflux-call-chain-practice-v1.mdx",
    "https://github.com/miniflux/v2/tree/51f2e0d8199ea8fa305081f6e175bba64b0ef94b",
    "https://miniflux.app/docs/development.html",
    "https://go.dev/doc/go1.26"
  ]
}
