{"description":"能够把领域不变量落实为关系约束，编写 forward-only migration，并让索引顺序与真实查询及 EXPLAIN 验证目标对齐。","domain":"relational-schema-migrations-indexes","id":"M2-05","milestone":"M2","name":"关系建模、约束、索引与 migration","prerequisites":{"hard":[{"id":"M2-04","version":1}],"recommended":[]},"required_evidence":[{"context":"same_context","independence":"independent","rule_ids":["schema-task-builds","schema-relations-constrained","migration-forward-only","lookup-index-plan-aligned"],"type":"implement"},{"context":"same_context","independence":"independent","rule_ids":["migration-tests-present"],"type":"test"},{"context":"same_context","independence":"independent","rule_ids":["schema-decisions-explained"],"type":"diagnose"}],"resource_refs":["web/src/content/learning/schema-migration-practice-v1.mdx","https://www.postgresql.org/docs/current/ddl-constraints.html","https://www.postgresql.org/docs/current/indexes-multicolumn.html","https://www.postgresql.org/docs/current/using-explain.html"],"review_policy":{"failure_remediation_after_days":1,"first_review_after_days":7,"success_interval_days":30},"version":1}