{"description":"能够把 transport、use case 与 storage 职责分开，由使用方定义最小接口，并通过 constructor 在程序入口显式组装依赖。","domain":"business-boundaries-dependency-wiring","id":"M2-03","milestone":"M2","name":"业务建模、包边界与依赖组装","prerequisites":{"hard":[{"id":"M2-02","version":1},{"id":"M1-06","version":1},{"id":"M1-08","version":2}],"recommended":[]},"required_evidence":[{"context":"same_context","independence":"independent","rule_ids":["layered-project-builds","usecase-boundary-correct","storage-contract-correct","transport-usecase-separated","dependency-wiring-explicit","constructor-calls-present","consumer-interface-owned"],"type":"implement"},{"context":"same_context","independence":"independent","rule_ids":["boundary-tests-present"],"type":"test"},{"context":"same_context","independence":"independent","rule_ids":["architecture-decisions-explained"],"type":"diagnose"}],"resource_refs":["web/src/content/learning/gocheck-architecture-practice-v1.mdx","https://go.dev/doc/modules/layout","https://go.dev/wiki/CodeReviewComments#interfaces","https://go.dev/doc/effective_go#interfaces_and_types"],"review_policy":{"failure_remediation_after_days":1,"first_review_after_days":7,"success_interval_days":30},"version":1}